Product Title,Brand,Source URL
"Nescafé Classic Instant Coffee, 100g  ",Nescafé  ,
"Tim Hortons Medium Roast Instant Coffee, 300g  ",Tim Hortons  ,
"Starbucks VIA Instant Coffee Colombia, 12 count  ",Starbucks  ,
"NESCAFÉ Gold Espresso Instant Coffee, 100g  ",NESCAFÉ  ,
"Maxwell House Original Blend Instant Coffee, 200g  ",Maxwell House  ,
"Folgers Classic Roast Instant Coffee Crystals, 120g  ",Folgers  ,
"NESCAFÉ Taster's Choice Decaf, 100g  ",NESCAFÉ  ,
"Kicking Horse Instant Coffee, 90g  ",Kicking Horse  ,
"Mount Hagen Organic Fairtrade Instant Coffee, 100g  ",Mount Hagen  ,
"Lavazza Prontissimo Intenso Instant Coffee, 95g  ",Lavazza  ,
